question,answer,retrieved_sources
Кто такой Прометей и за что его наказали?,"Согласно информации из документа doc_16, Прометей — титан, защитник людей, похитивший огонь с Олимпа и передавший его смертным. В наказание Зевс приковал его к скале, где орёл ежедневно клевал его печень. Символ человеческого прогресса и жер...","doc_16, doc_04, doc_17"
Как Орфей пытался спасти Эвридику?,"Согласно информации из документа doc_17, Орфей — легендарный певец и музыкант, сын Аполлона и музы Каллиопы. Своим пением он мог очаровывать зверей, деревья и даже богов. Спустился в Аид за своей женой Эвридикой, но нарушил запрет и потерял ...","doc_17, doc_02, doc_18"
Какие символы у Афины?,"Согласно информации из документа doc_05, Афина — богиня мудрости, военной стратегии и ремёсел. Родилась из головы Зевса в полном вооружении. Покровительница города Афины. Её символы: сова, оливковое дерево, эгида с головой Медузы Горгоны. В ...","doc_05, doc_08, doc_14"
Кто был женой Аида?,"Согласно информации из документа doc_14, Геракл (Геркулес) — величайший герой греческой мифологии, сын Зевса и Алкмены. Совершил двенадцать подвигов на службе у царя Эврисфея. После смерти стал богом и был принят на Олимп. Символы: львиная ш...","doc_14, doc_01, doc_17"
Чем известен Персей?,"Согласно информации из документа doc_18, Персей — герой, сын Зевса и Данаи. Убил горгону Медузу, использовав щит как зеркало. Спас Андромеду от морского чудовища. Основатель Микен. Символы: крылатые сандалии, шлем Аида, сумка для головы Меду...","doc_18, doc_11, doc_10"
